{"actual_observation":{"media_type":"application/json","origin":"SYNTHETIC","path":"values/not-run.json","sha256":"1c0e88bb4be43e78f517dce4f82087d7ecc6791746eb79fe778833537b4155f2"},"actual_snapshot_ref":{"artifact_id":"a02-snapshot","content_hash":"038f8876bfff4e958cbf15279e56b3858d6d599c24a22410a5f34f22bb60b503","kind":"PlatformSnapshot","revision":1},"authority":"VALUE_ONLY_RUNTIME_ADMISSION_REQUIRED","checks":{"answer_matching":{"comparison_digest":"00db4b8b2f6fb409ecf89e0a03464d020c22fab2483950b49d60d93bae1d575c","evidence":[{"media_type":"application/json","origin":"SYNTHETIC","path":"values/not-run.json","sha256":"1c0e88bb4be43e78f517dce4f82087d7ecc6791746eb79fe778833537b4155f2"}],"outcome":"UNAVAILABLE"},"coverage":{"comparison_digest":"82ee7a3e8334204015bbcc66db2d60a31d736b75e5b97d6b7b8b2e51622ff744","evidence":[{"media_type":"application/json","origin":"SYNTHETIC","path":"values/not-run.json","sha256":"1c0e88bb4be43e78f517dce4f82087d7ecc6791746eb79fe778833537b4155f2"}],"outcome":"UNAVAILABLE"},"policy":{"comparison_digest":"951dcc10717d25911236c5de73d1b4a54d908cb3bd5ce553a1051de291c692df","evidence":[{"media_type":"application/json","origin":"SYNTHETIC","path":"values/not-run.json","sha256":"1c0e88bb4be43e78f517dce4f82087d7ecc6791746eb79fe778833537b4155f2"}],"outcome":"UNAVAILABLE"},"source_integrity":{"comparison_digest":"ea9622801ac94bd2135fd473d8d2fb63cc08129dae70e55e82f31a5f5f2a86b8","evidence":[{"media_type":"application/json","origin":"SYNTHETIC","path":"values/not-run.json","sha256":"1c0e88bb4be43e78f517dce4f82087d7ecc6791746eb79fe778833537b4155f2"}],"outcome":"UNAVAILABLE"},"structure":{"comparison_digest":"5ffd4123cc3fa95214d51cb74d7349c09ee5348379372b86845c8c3221fc9cfb","evidence":[{"media_type":"application/json","origin":"SYNTHETIC","path":"values/not-run.json","sha256":"1c0e88bb4be43e78f517dce4f82087d7ecc6791746eb79fe778833537b4155f2"}],"outcome":"UNAVAILABLE"}},"decision":"HOLD","finished_at":"2026-10-17T00:00:00Z","format_version":"a03-synthetic-precheck-run-1","graph_ref":{"artifact_id":"a02-graph","content_hash":"823bf8915cf77eeaec54362efa557028170268bb85d8e376b9300f96be9511db","kind":"QuestionGraph","revision":1},"hold_event_head":{"hash":"fd630558539c65290c4fc024aade1a987e23b2afc666c784d681491b85931e1c","sequence":10},"hold_id":"static-not-an-active-hold","implementation_digest":"fe46dbe7a33503e304c6e291568d66bea2bb2d61c4f029f8b6a96ee88d538e62","input_hashes":[{"path":"assets/asset-page-a1.pgm","sha256":"8c1f2dc9061d60bad2a28778bf18f0356409b9fa8c370a0db6bd737012db2a75"},{"path":"assets/asset-page-a2.pgm","sha256":"9f4ab681d43e03b397154a2ba6dabf9b77e1bbfe576c62955d4385755f6d5d1b"},{"path":"assets/asset-page-b1.pgm","sha256":"f4d0189a5c4953e4401ef67acdc922d73a4414b7e86328e44b0ca98955243b84"}],"oracle":{"media_type":"application/json","origin":"SYNTHETIC","path":"values/oracle.json","sha256":"7ec217fa1cdbc31d8a79dce9f572e522f7863173acc4396f5e0648682383360d"},"policy_ref":{"content_hash":"5d914617cad7f10009ff34919b1c313d5c73bd322069b77cde54659a407ebc32","policy_id":"synthetic-a02-policy","revision":1},"producer_kind":"REGISTERED_SYNTHETIC_FIXTURE_VERIFIER_1","run_id":"static-unexecuted-pre-run","source_ref":{"artifact_id":"a02-source","content_hash":"7b761b95ea822931077cac9353be0e61be60654e7b71a4b35eae8a3fe61af5a4","kind":"SourceBundle","revision":1},"started_at":"2026-10-17T00:00:00Z"}
